"cnpj","dataReferencia","codigoCVM","codigoCVM2","codigoCVMsemDigito","codB3","setorCVM","dataConstituicao","dataSituacaoRegistroCVM","nomeEmpresarial","especieControleAcionario","mesEncerraExercSocial","descricaoAtividade"
"12.592.746/0001-10",2012-01-01,"22292","22292","2229",NA,"Emp. Adm. Part. - Petróleo e Gás","2010-09-13","2010-12-16","STEIN SP II PARTICIPAÇÕES S.A.","Privado Holding",12,""
"12.592.831/0001-89",2023-01-01,"26611","26611","2661",NA,"Emp. Adm. Part. - Sem Setor Principal","2010-09-21","2022-02-11","MNLT S.A.","Privado Holding",12,"credenciamento adm. de instrumento de pagamento desenvolvimento tecnológico automação representação de franquias e participação societária em outras pessoas jurídicas nacionais ou estrangeiras."
"12.919.786/0001-24",2023-01-01,"24066","24066","2406",NA,"Serviços Transporte e Logística","2010-10-27","2016-10-27","TCP TERMINAL DE CONTEINERES DE PARANAGUA SA","Privado",12,"Exploração de instalações portuárias e de área, atividade de operador portuário, demovimentação e armazenagem de carga e contêineres, veículos automotivos, bens, produtos eequipamentos."
"12.827.269/0001-25",2020-01-01,"24376","24376","2437",NA,"Hospedagem e Turismo","2010-11-04","2020-06-15","HRH ILHA DO SOL EMPREENDIMENTOS IMOBILIÁRIOS SPE S/A","Privado",12,"Planejamento, promoção, desenvolvimento, construção através de incorporação imobiliária,venda e entrega de unidades e recebimento de parcelas decorrentes de alienação de unidadesimobiliárias."
"12.979.898/0001-70",2021-01-01,"22489","22489","2248",NA,"Securitização de Recebíveis","2010-11-19","2011-06-15","FORTE SECURITIZADORA S.A.","Privado",12,"Securitização de Créditos Imobiliários e do Agronegócio."
"13.324.184/0001-97",2016-01-01,"22772","22772","2277","VIGR","Emp. Adm. Part. - Alimentos","2011-01-03","2012-04-02","VIGOR ALIMENTOS S.A.","Privado",12,"Produção e comércio de laticínios e derivados de óleo."
"13.349.677/0001-81",2022-01-01,"22802","22802","2280",NA,"Securitização de Recebíveis","2011-01-19","2022-06-01","REIT SECURITIZADORA S/A","Privado",12,"(i) a aquisição e securitização de créditos oriundos de operações e negócios de crédito imobiliário em geral e emissão e colocação de Certificados e Recebíveis Imobilários e de outros títulos"
"13.457.942/0001-45",2022-01-01,"24996","24996","2499",NA,"Construção Civil, Mat. Constr. e Decoração","2011-01-31","2020-07-28","RIVA INCORPORADORA S.A","Privado",12,"Incorporação de empreendimentos imobiliários"
"13.217.485/0001-11",2023-01-01,"24694","24694","2469","CNTO","Comércio (Atacado e Varejo)","2011-01-31","2019-04-15","Grupo SBF S.A.","Privado Holding",12,"A Companhia tem por objeto social (a) administração de bens próprios e, (b) a participação, como sócia ou acionista, em outras empresas."
"13.217.485/0001-11",2023-01-01,"24694","24694","2469","SBFG","Comércio (Atacado e Varejo)","2011-01-31","2019-04-15","Grupo SBF S.A.","Privado Holding",12,"A Companhia tem por objeto social (a) administração de bens próprios e, (b) a participação, como sócia ou acionista, em outras empresas."
"13.407.617/0001-78",2011-01-01,"22624","22624","2262",NA,"Energia Elétrica","2011-02-24","2011-12-09","Isolux Infrastructure S.A.","Estrangeiro",12,"Desenvolvimento, implantação, construção, conservação em concessões e ativos regulados de infraestrutura, principalmente transporte rodoviário, transmissão de energia e fabricação de painéis solares."
"13.407.573/0001-86",2016-01-01,"22578","22578","2257","HPIA","Emp. Adm. Part. - Sem Setor Principal","2011-02-24","2011-08-18","HARPIA ÔMEGA PARTICIPAÇÕES S.A.","Privado Holding",12,"A Companhia tem por objeto social a participação em outras Sociedades, como sócia ou acionista, no país ou no exterior (holding)."
"13.444.994/0001-87",2023-01-01,"22586","22586","2258",NA,"Emp. Adm. Part. - Sem Setor Principal","2011-03-10","2011-09-12","MLOG S.A.","Privado",12,"ABN e CNA em operação, navegação offshore e de interior. NSN pré operacional no setor de navegação. MOPI pré operacional no setor de mineração. CDNC pré operacional no setor de logística."
"13.522.948/0001-59",2023-01-01,"27138","27138","2713","SAEN","Emp. Adm. Part. - Energia Elétrica","2011-03-16","2023-03-15","Safira Holding S.A.","Privado",12,"Holdings de instituições financeiras e não financeiras geração e comercialização de energia em todas as suas formas assessoria empresarial manutenção e gestão de sistema fotovoltaico, dentre outros"
"14.333.683/0001-03",2021-01-01,"23019","23019","2301",NA,"Securitização de Recebíveis","2011-03-18","2013-01-16","FONTAINE VILLE PARTICIPAÇÕES S/A","Privado",12,"Empr. Adm. Part. - Const. Civil, Mat. Const. e Decoração"
"13.878.847/0001-15",2018-01-01,"24074","24074","2407",NA,"Securitização de Recebíveis","2011-04-04","2018-05-29","PERDIZES - SECURITIZADORA DE RECEBÍVEIS COMERCIAIS S/A","Privado",12,"Securitização de direitos creditórios comerciais,industriais,imobiliários,financeiros e do agronegócioemissão de valores mobiliariosprestação de serviços relacionados a atividade de securitização."
"13.584.310/0001-42",2022-01-01,"23957","23957","2395",NA,"Emp. Adm. Part. - Const. Civil, Mat. Const. e Decoração","2011-04-04","2016-07-19","SUGOI S.A.","Privado",12,"CNAE 41.10-07-00 - Incorporação de empreendimentos imobiliários."
"13.483.537/0001-00",2021-01-01,"24287","24287","2428",NA,"Securitização de Recebíveis","2011-04-06","2017-12-12","BRASIL SECURITIZADORA S/A","Privado",12,"Securitização de direitos creditórios comerciais,industriais,imobiliarios,financeiros,e do agronegócioemissão de valores mobiliários,prestação de serviços relacionados a atividade de securitização."
"13.574.594/0001-96",2023-01-01,"24317","24317","2431","BKBR","Alimentos","2011-04-06","2017-12-14","ZAMP SA","Privado",12,"Prestação de serviços de operação e assessoria a restaurantes"
"13.574.594/0001-96",2023-01-01,"24317","24317","2431","ZAMP","Alimentos","2011-04-06","2017-12-14","ZAMP SA","Privado",12,"Prestação de serviços de operação e assessoria a restaurantes"
"13.776.362/0001-10",2012-01-01,"22705","22705","2270",NA,"Emp. Adm. Part. - Hospedagem e Turismo","2011-05-03","2012-01-30","Brasil Travel Turismo e Participações S.A.","Privado Holding",12,"Participação no capital social de sociedades dentre as quais agências de viagens e turismo."
"14.191.427/0001-29",2023-01-01,"25321","25321","2532",NA,"Emp. Adm. Part. - Agricultura (Açúcar, Álcool e Cana)","2011-06-13","2020-11-13","GranBio Investimentos S.A.","Privado",12,"Atuação, por meio de suas controladas, em atividades relacionadas à produção de bioquímicos e biocombustíveis"
"14.200.537/0001-00",2014-01-01,"22640","22640","2264",NA,"Emp. Adm. Part. - Sem Setor Principal","2011-06-15","2011-12-12","NISA PARTICIPACOES S.A.","Privado Holding",12,"A Companhia tem por objeto social a participação em outras sociedades, como sócia ou acionista ou em consórcios, no país ou no exterior."
"14.200.586/0001-42",2018-01-01,"22667","22667","2266",NA,"Emp. Adm. Part. - Sem Setor Principal","2011-06-15","2015-09-18","NAOMI PARTICIPAÇÕES S.A.","Privado Holding",12,"A Companhia tem por objeto social a participação em outras sociedades, como sócia ou acionista ou em consórcios, no país ou no exterior."
"14.200.618/0001-00",2018-01-01,"22632","22632","2263",NA,"Emp. Adm. Part. - Sem Setor Principal","2011-06-15","2011-12-12","BELEZA PARTICIPAÇÕES S.A.","Privado Holding",12,"A Companhia tem por objeto social a participação em outras sociedades, como sócia ou acionista ou em consórcios, no país ou no exterior."
"14.200.699/0001-48",2019-01-01,"22659","22659","2265",NA,"Emp. Adm. Part. - Sem Setor Principal","2011-06-15","2011-12-12","NOAH PARTICIPAÇÕES S.A.","Privado Holding",12,"A Companhia tem por objeto social a participação em outras sociedades, como sócia ou acionista ou em consórcios, no país ou no exterior."
"14.042.551/0001-22",2014-01-01,"22730","22730","2273",NA,"Petróleo e Gás","2011-07-01","2012-02-13","Seabras Serviços de Petróleo S.A","Privado",12,"Serviços de afretamento e operação de sondas de pesquisa e perfuração de poços de petróleo e gás natural e embarcações de apoio marítimo."
"14.969.641/0001-63",2014-01-01,"22969","22969","2296",NA,"Energia Elétrica","2011-07-18","2012-09-06","Rio Monsarás Participações S.A.","Privado Holding",12,"Construção, instalação, operação e exploração de empreendimentos de geração de energia elétrica e realização de estudos e projetos nesse setor."
"14.882.295/0001-81",2023-01-01,"23620","23620","2362",NA,"Emp. Adm. Part. - Petróleo e Gás","2011-07-20","2015-06-11","CBO HOLDING S.A.","Privado",12,"Participação, na qualidade de sócia ou por meio de outras modalidades de investimento, em outras empresas que atuem na prestação de serviços de apoio marítimo à indústria de óleo e gás."
"14.127.813/0001-51",2023-01-01,"25887","25887","2588","NINJ","Comunicação e Informática","2011-07-25","2021-05-13","GetNinjas S.A.","Privado",12,"A Companhia é uma plataforma inovadora, disponível para sistemas Android, iOS e web, presente em todos os Estados do Brasil e conecta digitalmente profissionais de variadas áreas a potenciais clientes"
"94.813.102/0001-70",2023-01-01,"25950","25950","2595","TTEN","Agricultura (Açúcar, Álcool e Cana)","2011-07-27","2021-06-21","Três Tentos Agroindustrial S/A","Privado",12,"Varejo de insumos agrícolas Recebimento e comercialização de grãos de soja, milho e trigo e Indústria, na cadeia de soja."
"13.783.221/0004-78",2023-01-01,"26379","26379","2637",NA,"Alimentos","2011-08-01","2021-11-17","MADERO INDÚSTRIA E COMÉRCIO S.A.","Privado",12,"Fabricação e comercialização de produtos alimentícios em geral"
"14.110.585/0001-07",2023-01-01,"25232","25232","2523","CASH","Comunicação e Informática","2011-08-11","2020-11-03","MÉLIUZ S.A.","Privado",12,"Portal virtual para veiculação e divulgação de marcas, produtos e outros materiais, locação de espaço publicitário, intermediação de negócios, licenciamento de softwares e participação em sociedades."
"14.206.371/0001-39",2018-01-01,"23205","23205","2320",NA,"Máquinas, Equipamentos, Veículos e Peças","2011-08-16","2013-09-20","BR TOWERS SPE1 S.A","Privado",12,"Locação, comercialização e construção de equipamentos para exploração de serviços de telecomunicações por terceiros."
"19.688.956/0001-56",2020-01-01,"80179","80179","8017","GBIO","Emp. Adm. Part. - Farmacêutico e Higiene","2011-08-16","2017-07-21","BIOTOSCANA INVESTMENTS S.A.","Estrangeiro Holding",12,""
"14.292.540/0001-09",2023-01-01,"27316","27316","2731",NA,"Telecomunicações","2011-08-22","2023-09-04","Brazil Tower, Cessão de Infra-Estruturas S.A","Privado Holding",12,"Cessão de espaço em infraestruturas a terceiros para instalação de transmissores de telecomunicações aquisição, locação ou arrendamento de imóveis para as infraestruturas."
"15.114.494/0001-02",2023-01-01,"27260","27260","2726",NA,"Serviços Transporte e Logística","2011-11-17","2023-08-09","Corredor Logística e Infraestrutura S.A.","Privado",12,"Exploração de terminal portuário."
"14.785.152/0001-51",2023-01-01,"25402","25402","2540","HBRE","Construção Civil, Mat. Constr. e Decoração","2011-12-02","2020-12-18","HBR Realty Empreendimentos Imobiliários S.A.","Privado",12,"Deter patrimônio constituído por bens imóveis e direitos a eles relativos administrar bens imóveis próprios e de terceiros e participar, como sócia ou acionista, em outras sociedades."
"13.270.520/0001-66",2023-01-01,"25879","25879","2587","KRSA","Serviços médicos","2011-12-08","2021-05-13","Kora Saúde Participações S.A.","Privado",12,"Prestação de serviços de atenção à saúde humana, limpeza, planos de saúde, bem como outras atividades secundárias de aluguel de imóveis e holding de instituições não financeiras"
"15.229.110/0001-05",2022-01-01,"23353","23353","2335",NA,"Securitização de Recebíveis","2011-12-12","2022-06-01","CAPITALE SECURITIZADORA DE CRÉDITO S/A","Privado",12,"Aquisição, securitização, cessão reaquisição de quaisquer direitos créditorios emissão e colocação de titulos e valores mobiliarios prestação de serviços compativeis com suas atividades."
"15.090.690/0001-94",2023-01-01,"26638","26638","2663",NA,"Serviços Transporte e Logística","2011-12-13","2022-03-15","CONCESSIONARIA ECOVIAS DO ARAGUAIA S.A.","Privado",12,"A realização, sob regime de concessão, da exploração da infraestrutura e da prestação de serviços públicos, conforme Edital de Concessão 01/2021 da Agência Nacional de Transportes Terrestres (ANTT)."
"14.962.356/0001-10",2019-01-01,"22853","22853","2285",NA,"Emp. Adm. Part. - Sem Setor Principal","2011-12-16","2016-04-14","FRIGOL FOODS PARTICIPAÇÕES S.A.","Privado",12,"Participação em outras sociedades como sócia ou acionista."
"15.011.696/0001-29",2017-01-01,"23973","23973","2397",NA,"Securitização de Recebíveis","2012-02-07","2016-08-08","AVAL SECURITIZADORA DE CREDITOS S.A.","Privado",12,"Securitização de quaisquer direitos creditórios emissão e colocação de títulos e valoresmobiliários"
"15.463.423/0001-15",2014-01-01,"23299","23299","2329","MLPP","Emp. Adm. Part. - Telecomunicações","2012-03-02","2013-11-22","JP Participações S.A.","Privado Holding",12,""
"15.484.093/0001-44",2023-01-01,"23582","23582","2358",NA,"Serviços Transporte e Logística","2012-03-22","2015-04-10","ECO101 CONCESSIONÁRIA DE RODOVIAS S.A.","Privado",12,"Concessão e Exploração de Rodovias"
"16.103.773/0001-33",2015-01-01,"23116","23116","2311",NA,"Emp. Adm. Part. - Intermediação Financeira","2012-03-27","2013-03-26","FINPAR PARTICIPAÇÕES S/A","Privado Holding",12,""
"15.494.541/0001-90",2023-01-01,"23540","23540","2354",NA,"Construção Civil, Mat. Constr. e Decoração","2012-03-27","2015-01-05","SALUS INFRAESTRUTURA PORTUARIA SA","Privado",12,"Infraestrutura Portuária"
"15.483.430/0001-89",2015-01-01,"23108","23108","2310",NA,"Emp. Adm. Part. - Sem Setor Principal","2012-04-02","2013-03-22","BPMB I Participações S.A.","Privado Holding",12,"A Companhia tem por objeto social a participação em outras Sociedades, como sócia ou acionista, no país ou no exterior (holding)."
"15.377.572/0001-61",2022-01-01,"23906","23906","2390",NA,"Securitização de Recebíveis","2012-04-11","2021-11-03","NASA SECURITIZADORA S.A.","Privado",12,"Securitização de recebíveis"
"15.688.041/0001-90",2023-01-01,"22861","22861","2286",NA,"Securitização de Recebíveis","2012-04-13","2012-07-23","MBK SECURITIZADORA SA","Privado",12,""
"15.440.708/0001-30",2023-01-01,"27405","27405","2740",NA,"Emp. Adm. Part. - Serviços Transporte e Logística","2012-04-20","","Concessionária ViaRio S.A.","Privado",12,"Prestadora de serviços de implantação, operação, manutenção, monitoração, conservação e realização de melhorias da Ligação Transolímpica, por meio de concessões de rodovias, pontes, túneis e serviços."
"17.346.997/0001-39",2020-01-01,"23485","23485","2348","RLOG","Serviços Transporte e Logística","2012-04-23","2014-09-11","COSAN LOGISTICA S.A.","Privado Holding",12,"Administração, direta ou indireta, de participações societárias em empresas do setor de infraestrutura."
"15.578.569/0001-06",2023-01-01,"23515","23515","2351",NA,"Serviços Transporte e Logística","2012-05-08","2014-10-24","CONC DO AEROPORTO INTERNACIONAL DE GUARULHOS S.A.","Privado",12,"Concessão Aeroportuária"
"16.811.931/0001-00",2023-01-01,"25275","25275","2527","AVLL","Construção Civil, Mat. Constr. e Decoração","2012-05-15","2020-11-05","ALPHAVILLE S.A.","Privado",12,"Holding controladora de empresas que atuam no setor de urbanismo e desenvolvimento de empreendimentos imobiliários."
"15.914.972/0001-69",2016-01-01,"22950","22950","2295",NA,"Securitização de Recebíveis","2012-05-23","2015-02-20","AR CAPITAL SECURITIES COMPANHIA SECURITIZADORA S.A.","Privado",12,"Aquisição e securitização de créditos imobiliários e/ou do agronegócio."
"15.675.715/0001-11",2022-01-01,"25313","25313","2531",NA,"Emp. Adm. Part. - Const. Civil, Mat. Const. e Decoração","2012-05-28","2022-06-21","Housi S.A.","Privado",12,"A Companhia dedica-se à atividades de desenvolvimento imobiliário, gestão patrimonial e incorporação imobiliária."
"15.912.764/0001-20",2017-01-01,"23140","23140","2314",NA,"Comércio (Atacado e Varejo)","2012-06-10","2013-04-25","SMILES S.A.","Privado",12,"Programa de milhagem para fidelizar os clientes, próprio ou de terceiros. Acúmulo de Milhas pela compra de passagens aéreas uso de cartão de crédito, hotéis, locadoras de veículos e restaurantes."
"16.922.038/0001-51",2023-01-01,"25259","25259","2525","ENJU","Comércio (Atacado e Varejo)","2012-08-01","2020-11-05","ENJOEI S.A.","Privado",12,"Plataforma digital de compra e venda de para produtos usados, por meio da criação de lojas virtuais pelos próprios usuários"
"16.838.421/0001-26",2023-01-01,"27111","27111","2711",NA,"Emp. Adm. Part. - Sem Setor Principal","2012-08-10","2023-02-28","XP Investimentos S.A.","Privado",12,"Sociedade detentora de participação em Corretoras de Títulos, Câmbio e Valores Mobiliários,Instituições Financeiras, Seguradoras e outras sociedades."
"17.234.244/0001-31",2023-01-01,"23370","23370","2337",NA,"Serviços Transporte e Logística","2012-10-29","2014-04-25","FTL - FERROVIA TRANSNORDESTINA LOGÍSTICA S.A.","Privado",12,"Transporte Ferroviário de Cargas."
"14.776.142/0001-50",2023-01-01,"25518","25518","2551","WEST","Comércio (Atacado e Varejo)","2012-12-12","2021-02-09","WESTWING COMÉRCIO VAREJISTA S.A.","Privado",12,"Comércio físico e digital varejista de móveis e artigos domésticos em geral, vestuário e bens e acessórios de uso pessoal serviços de design de interiores e arquitetura."
"17.344.597/0001-94",2023-01-01,"23159","23159","2315","BBSE","Emp. Adm. Part. - Seguradoras e Corretoras","2012-12-20","2013-04-25","BB SEGURIDADE PARTICIPAÇÕES S.A.","Estatal",12,"Participação no capital social de outras sociedades que realizem quaisquer atividades reguladas pela SUSEP e ANS, além de corretagem desses produtos."
"17.568.683/0001-80",2017-01-01,"23337","23337","2333",NA,"Securitização de Recebíveis","2013-01-09","2014-01-16","ISEC BRASIL SECURITIZADORA S/A","Privado",12,"(i) a aquisição e securitização de créditos imobiliários e de títulos e valores mobiliários (ii) a emissão e colocação, no mercado financeiro, de Certificados de Recebíveis Imobiliários (CRI's)."
"17.632.564/0001-40",2014-01-01,"23256","23256","2325",NA,"Securitização de Recebíveis","2013-01-28","2013-10-25","Consult Securitizadora S/A","Privado",12,"Securitização de recebíveis, que comporta aquisição, securitização, emissão, negociação e prestação de serviços relacionados a créditos imobiliários e de agronegócios passíveis de securitização."
"18.572.225/0001-88",2023-01-01,"23868","23868","2386",NA,"Serviços Transporte e Logística","2013-01-30","2016-02-19","CONCEBRA - CONCESSIONARIA DAS RODOVIAS CENTRAIS DO BRASIL","Privado",12,"52.21-4-00 - Concessionárias de rodovias, pontes, túneis e serviços relacionados"
"17.943.792/0001-30",2023-01-01,"26336","26336","2633",NA,"Construção Civil, Mat. Constr. e Decoração","2013-04-16","2021-11-12","FULWOOD S.A.","Privado",12,"Administração, gestão comercialização e locação de imóveis atividades de consultoria e assessoria imobiliária, financeira e administrativa, e participação em outras sociedades."
"03.494.776/0001-01",2023-01-01,"26476","26476","2647",NA,"Emp. Adm. Part. - Têxtil e Vestuário","2013-05-06","2021-12-14","AMMO VAREJO S.A.","Privado",12,"Descrição da Atividade: Comércio de: (i) de cama, mesa e banho (ii) móveis e artigos domésticos em geral (iii) cosméticos, produtos de perfumaria e de higiene pessoal."
"18.174.270/0001-84",2023-01-01,"25836","25836","2583","DOTZ","Comunicação e Informática","2013-05-14","2021-05-12","Dotz S.A.","Privado Holding",12,"desenvolvimento e gerenciamento de programa de fidelização de clientes em razão do consumo de bens e serviços oferecidos por parceiros comercialização de direitos de resgate e prêmios."
"18.328.118/0001-09",2023-01-01,"25089","25089","2508","PETZ","Comércio (Atacado e Varejo)","2013-06-19","2020-09-09","Pet Center Comércio e Participações S.A.","Privado",12,"Importação, exportação e comércio (inclusive via internet e-commerce) de artigos para animais, plantas, flores, sementes hospital veterinário, consultório, clínica veterinária, banho/tosa e hotel."
"18.593.815/0001-97",2023-01-01,"24236","24236","2423","PRNR","Construção Civil, Mat. Constr. e Decoração","2013-07-12","2017-10-02","PRINER SERVIÇOS INDUSTRIAIS S.A.","Privado",12,"Prestação de serviços industriais, principalmente nos segmentos petroquímico, óleo e gás, siderurgia, papel e celulose e químico."
"18.483.666/0001-03",2023-01-01,"25933","25933","2593","GRAO","Comércio (Atacado e Varejo)","2013-07-15","2021-06-10","Humberg Agribrasil Comércio e Exportação de Grãos S.A.","Privado",12,"Venda, compra, revenda e distribuição de produtos in natura de origem vegetal (cereais e grãos), a granel ou em contêineres, no/para o mercado interno e externo."
"18.494.485/0001-82",2023-01-01,"23523","23523","2352","PSVM","Emp. Adm. Part. - Serviços Transporte e Logística","2013-07-16","2014-11-11","PORTO SUDESTE V.M. S.A.","Privado",12,"Investimentos no setor de transporte e logística"
"18.903.785/0001-78",2023-01-01,"26565","26565","2656",NA,"Serviços Transporte e Logística","2013-08-20","2021-12-23","HOLDING DO ARAGUAIA S.A.","Privado Holding",12,"A participação em sociedades de propósito específico, constituídas sob a forma de sociedade por ações, excetuadas instituições financeiras."
"19.133.012/0001-12",2020-01-01,"23744","23744","2374",NA,"Securitização de Recebíveis","2013-09-25","2015-10-22","RENOVA COMPANHIA SECURITIZADORA DE CRÉDITOS FINANCEIROS S.A.","Privado",12,"Aquisição e securitização de créditos oriundos de operações financeiras, nos termos daResolução do Banco Central do Brasil nº 2.686, de 26 de janeiro de 2000, conforme alterada."
"19.014.221/0001-47",2023-01-01,"27103","27103","2710",NA,"Energia Elétrica","2013-09-26","2023-02-23","China Three Gorges Brasil Energia S.A.","Privado",12,"Holdings de instituições não-financeiras."
"19.276.528/0001-16",2023-01-01,"24775","24775","2477",NA,"Emp. Adm. Part. - Serviços médicos","2013-10-21","2019-09-16","BCBF Participações S.A.","Privado",12,"Prestação de serviços de assistência à saúde e odontológica."
"19.208.022/0001-70",2023-01-01,"23884","23884","2388",NA,"Serviços Transporte e Logística","2013-10-28","2016-03-02","ECO050 CONCESSIONÁRIA DE RODOVIAS S.A.","Privado",12,"Exploração da infraestrutura e da prestação do serviço público de recuperação, operação, manutenção, conservação, implantação de melhorias e ampliação de capacidade da rodovia federal BR-050 / GO/MG"
"19.527.586/0001-75",2023-01-01,"24155","24155","2415",NA,"Energia Elétrica","2013-10-28","2017-06-22","COMPANHIA ENERGÉTICA SINOP S/A","Privado",12,"A Companhia tem como objeto social único e exclusivo a construção, implantação, operação,manutenção e exploração comercial da Usina Hidrelétrica Sinop pelo prazo de concessãoconcedida pela ANEEL."
"19.288.959/0001-00",2015-01-01,"23400","23400","2340",NA,"Securitização de Recebíveis","2013-11-01","2014-05-27","SCCA - SECURITIZADORA DE CRÉDITOS DO AGRONEGÓCIO S.A.","Privado",12,"Emissão e colocação, no mercado financeiro e de capitais, de Certificados de Direitos Creditórios do Agronegócio (CDCA) e Certificados de Recebíveis do Agronegócio (CRA), bem como de outros títulos."
"09.347.516/0001-81",2023-01-01,"25569","25569","2556","ELMD","Emp. Adm. Part. - Comunicação e Informática","2013-11-07","2021-02-11","ELETROMIDIA S.A.","Privado",12,"Prestação de serviços de distribuição e comercialização de painés eletrônicos e publicidade."
"19.521.322/0001-04",2023-01-01,"23922","23922","2392",NA,"Serviços Transporte e Logística","2013-12-27","2016-06-07","CONCESSIONÁRIA ROTA DO OESTE S.A.","Privado",12,""
"19.511.433/0001-30",2015-01-01,"23361","23361","2336",NA,"Securitização de Recebíveis","2014-01-02","2014-03-26","SPE AKRO Securitizadora S.A.","Privado",12,"Aquisição e securitização de créditos imobiliários"
"19.642.306/0001-70",2023-01-01,"23833","23833","2383",NA,"Emp. Adm. Part. - Serviços Transporte e Logística","2014-01-21","2016-02-03","CONCESSIONÁRIA DE RODOVIA SUL-MATOGROSSENSE S.A.","Privado",12,"Concessão de Rodovias."
"19.851.496/0001-35",2022-01-01,"23477","23477","2347",NA,"Securitização de Recebíveis","2014-01-28","2014-09-04","LOGOS COMPANHIA SECURITIZADORA S/A","Privado",12,"Securitização de recebíveis, que comporta aquisição, securitização, emissão, negociação e prestação de serviços relacionados a créditos imobiliários e de agronegócios passíveis de securitização."
"20.445.827/0001-16",2017-01-01,"23752","23752","2375",NA,"Securitização de Recebíveis","2014-01-31","2015-11-11","SEC TWO COMPANHIA SECURITIZADORA DE CRÉDITOS","Privado",12,"Securitização de direitos creditórios comerciais,industriais,imobiliários,financeiros e do agronegócioemissão de valores mobiliariosprestação de serviços relacionados a atividade de securitização."
"19.726.048/0001-00",2023-01-01,"23892","23892","2389",NA,"Serviços Transporte e Logística","2014-01-31","2016-03-18","CONCESSIONÁRIA BR-040 S.A.","Privado Holding",12,"Exploração do pedágio, operação, manutenção e exploração dos trechos rodoviários da BR-040/DF/GO/MG."
