"cnpj","dataReferencia","codigoCVM","codigoCVM2","codigoCVMsemDigito","codB3","setorCVM","dataConstituicao","dataSituacaoRegistroCVM","nomeEmpresarial","especieControleAcionario","mesEncerraExercSocial","descricaoAtividade"
"49.263.189/0001-02",2023-01-01,"20877","20877","2087","HBOR","Construção Civil, Mat. Constr. e Decoração","1977-10-20","2007-07-09","HELBOR EMPREENDIMENTOS S.A.","Privado",12,"Incorporação de Imoveis"
"05.441.787/0001-40",2018-01-01,"512729","512729","51272",NA,"Hospedagem e Turismo","1977-12-16","2009-08-21","NORTE HOTELARIA S.A.","Privado",12,""
"83.475.913/0001-91",2023-01-01,"13773","13773","1377","PTBL","Construção Civil, Mat. Constr. e Decoração","1977-12-22","1991-01-04","PBG S/A","Privado",12,""
"29.978.814/0001-87",2022-01-01,"21121","21121","2112","SULA","Emp. Adm. Part. - Seguradoras e Corretoras","1978-03-13","2007-10-03","SUL AMERICA S.A.","Privado",12,"A Sul América S.A. é uma sociedade de participação e suas controladas atuam nos setores de seguros, previdência complementar, administração de recursos e assistência à saúde."
"29.980.141/0001-08",2023-01-01,"26956","26956","2695",NA,"Emp. Adm. Part. - Petróleo e Gás","1978-05-02","2022-09-21","Oceânica Engenharia e Consultoria S.A.","Privado",12,"Prestação de serviços de engenharia submarina, inspeção, intervenção e monitoramento de estruturas submarinas e subaquáticas para a indústria de óleo e gás e energia renovável."
"89.637.490/0001-45",2023-01-01,"12653","12653","1265","KLBN","Papel e Celulose","1978-11-08","1997-08-06","KLABIN S.A.","Privado",12,"Empresa brasileira de base florestal. Produtora de papéis e cartões para embalagens, embalagens de papelão ondulado e sacos industriais, além de ser recicladora e produtora de toras para serrarias."
"89.547.269/0001-04",2018-01-01,"12858","12858","1285",NA,"Comunicação e Informática","1978-11-27","1986-06-20","DIGITEL SA INDUSTRIA ELETRONICA","Privado",12,""
"15.413.826/0001-50",2023-01-01,"5576","05576","557","ENER","Energia Elétrica","1979-01-01","1981-08-28","ENERGISA MATO GROSSO DO SUL - DIST DE ENERGIA S.A.","Privado",12,"Distribuição de energia elétrica"
"30.306.294/0001-45",2023-01-01,"22616","22616","2261","BPAC","Bancos","1979-01-18","2011-11-10","BCO BTG PACTUAL S.A.","Privado",12,"A Companhia e suas controladas formam um grupo de prestação de serviços financeirossediado no Brasil, atuando como banco múltiplo, com carteira de investimento, nos termos dalegislação aplicável."
"51.218.147/0001-93",2023-01-01,"20494","20494","2049","IGTA","Comércio (Atacado e Varejo)","1979-05-23","2007-02-02","IGUATEMI EMPRESA DE SHOPPING CENTERS S.A","Privado",12,"Empresa full service no setor de shopping centers. Suas atividades englobam a concepção, oplanejamento, o desenvolvimento e a administração de shopping centers regionais e complexosimobiliários."
"14.807.945/0001-24",2023-01-01,"12696","12696","1269","SNSY","Petroquímicos e Borracha","1979-10-03","1986-05-06","SANSUY S.A. INDUSTRIA DE PLASTICOS","Privado",12,"INDÚSTRIA E COMÉRCIO DE ARTEFATOS PLÁSTICOS"
"51.128.999/0001-90",2023-01-01,"21334","21334","2133","NUTR","Agricultura (Açúcar, Álcool e Cana)","1979-10-16","2008-02-11","NUTRIPLANT INDUSTRIA E COMERCIO S.A.","Privado",12,"Industria e comércio de fertilizantes para agricultura."
"59.981.829/0001-65",2023-01-01,"25801","25801","2580","RBNS","Máquinas, Equipamentos, Veículos e Peças","1979-11-19","2021-05-06","Rodobens SA","Privado Holding",12,"(i) a participação no capital social de outras sociedades (ii) a alocação e a gestão de recursos próprios e (iii) a consultoria estratégica e de gestão de negócios."
"43.470.988/0001-65",2023-01-01,"20524","20524","2052","EVEN","Construção Civil, Mat. Constr. e Decoração","1980-05-05","2007-03-02","EVEN CONSTRUTORA E INCORPORADORA S.A.","Privado",12,"Construção, incorporação e loteamento."
"30.723.886/0001-62",2023-01-01,"25755","25755","2575","MODL","Bancos","1980-07-29","2021-04-28","BANCO MODAL S.A.","Privado",12,"A Companhia tem por objeto social a prestação de serviços de banco múltiplo, nas carteiras comercial e de investimento, bem com realização de operações no mercado de câmbio."
"89.463.822/0001-12",2023-01-01,"20060","20060","2006","LUPA","Máquinas, Equipamentos, Veículos e Peças","1980-08-08","2006-05-08","LUPATECH S.A","Privado",12,"Fabricante de equipamentos e provedor de serviços para o setor de Petróleo e Gás."
"75.315.333/0001-09",2023-01-01,"24171","24171","2417","CRFB","Emp. Adm. Part. - Comércio (Atacado e Varejo)","1980-08-13","2017-07-18","ATACADÃO S.A.","Estrangeiro",12,"Comércio varejista e atacadista de mercadorias em geral Carga e descarga Correspondentes de instituições financeiras Atividades de teleatendimento Serviços de Alimentação entre outros"
"44.689.123/0001-57",2013-01-01,"12220","12220","1222","UCOP","Agricultura (Açúcar, Álcool e Cana)","1980-10-07","1985-01-16","USINA COSTA PINTO SA ACUC ALC","Privado",3,"Distribuição de combustíveis em geral, a importação, a exportação, a produção e a comercialização de açúcar, de álcool, de cana-de-açúcar e demais derivados destes a navegação exploração agrícola."
"02.635.522/0001-95",2023-01-01,"25496","25496","2549","JALL","Agricultura (Açúcar, Álcool e Cana)","1980-11-28","2021-02-04","Jalles Machado S.A.","Privado",3,"Exploração agrícola industrial e comercial em todas as suas modalidades, especialmente no que diz respeito à produção de cana-de-açúcar, seus subprodutos, em especial do açúcar e do álcool."
"27.093.558/0001-15",2023-01-01,"22012","22012","2201","MILS","Serviços Transporte e Logística","1980-12-01","2010-04-14","MILLS LOCAÇÃO, SERVIÇOS E LOGÍSTICA S.A.","Privado Holding",12,"Locação e venda de peças, máquinas e equipamentos pesados"
"45.242.914/0001-05",2023-01-01,"24848","24848","2484","CEAB","Têxtil e Vestuário","1981-01-12","2019-10-24","C&A Modas S.A.","Privado",12,"Atuação no varejo nos setores de vestuário, acessórios, calçados, higiene, eletrônicos, dentre outros."
"16.614.075/0001-00",2023-01-01,"21350","21350","2135","DIRR","Construção Civil, Mat. Constr. e Decoração","1981-02-19","2008-02-29","DIRECIONAL ENGENHARIA S.A.","Privado Holding",12,"Incorporação, construção e comercialização de imóveis próprios ou de terceiros e prestação de serviços de engenharia."
"06.626.253/0001-51",2023-01-01,"22608","22608","2260","PGMN","Comércio (Atacado e Varejo)","1981-05-19","2011-10-21","EMPREENDIMENTOS PAGUE MENOS S.A.","Privado",12,"Comércio de produtos farmacêuticos, perfumarias e afins, sem manipulação de fórmulas."
"87.762.563/0001-03",2023-01-01,"3298","03298","329","HBTS","Emp. Adm. Part. - Crédito Imobiliário","1981-09-28","1982-04-19","CIA HABITASUL DE PARTICIPACOES","Privado",12,"Participação em sociedades, civis ou comerciais prestação de serviços técnicos de planejamento, organização e estruturação de empresas ou grupos empresariais."
"47.509.120/0001-82",2023-01-01,"19640","19640","1964",NA,"Arrendamento Mercantil","1981-10-15","2004-11-24","BRADESCO LEASING S.A. ARREND MERCANTIL","Privado",12,"Prática das operações de arrendamento mercantil, observadas as disposições da legislação em vigor."
"47.508.411/0001-56",2023-01-01,"14826","14826","1482","PCAR","Comércio (Atacado e Varejo)","1981-11-10","1995-04-04","CIA BRASILEIRA DE DISTRIBUICAO","Privado",12,"Comércio Varejista"
"49.669.856/0001-43",2023-01-01,"21440","21440","2144","LLIS","Emp. Adm. Part. - Comércio (Atacado e Varejo)","1982-04-19","2008-04-18","VESTE S.A. ESTILO","Privado",12,"(a) confecção de produtos em geral, através de terceiros (b) importação e exportação (c) exploração de comércio e indústria de confecção de produtos em geral."
"49.669.856/0001-43",2023-01-01,"21440","21440","2144","VSTE","Emp. Adm. Part. - Comércio (Atacado e Varejo)","1982-04-19","2008-04-18","VESTE S.A. ESTILO","Privado",12,"(a) confecção de produtos em geral, através de terceiros (b) importação e exportação (c) exploração de comércio e indústria de confecção de produtos em geral."
"15.527.906/0001-36",2021-01-01,"22845","22845","2284","BSEV","Agricultura (Açúcar, Álcool e Cana)","1982-09-01","2012-07-12","BIOSEV S.A.","Privado",3,"Produção, processamento, industrialização, distribuição e comercialização de cana-de-açúcar e seus derivados, açúcar e etanol entre outros."
"51.928.174/0001-50",2023-01-01,"13471","13471","1347","PLAS","Emp. Adm. Part. - Máqs., Equip., Veíc. e Peças","1983-08-23","1989-04-19","PLASCAR PARTICIPACOES INDUSTRIAIS S.A.","Privado",12,"Participação em outras empresas"
"70.216.429/0001-04",2015-01-01,"518700","518700","51870",NA,"Agricultura (Açúcar, Álcool e Cana)","1983-11-08","2014-08-06","BRAMEX - BRASIL MERCANTIL S.A.","Privado",12,"Criação de camarões em água salgada e salobra, Criação de camarões em água doce."
"53.113.791/0001-22",2023-01-01,"19992","19992","1999","TOTS","Comunicação e Informática","1983-12-13","2006-03-07","TOTVS S.A.","Privado",12,"Prestação de serviços de consultoria, assessoria e desenvolvimento de sistemas informatizados (software), atividades de pesquisa e inovação tecnológica, prestação de serviços relacionados à gestão."
"07.334.600/0001-35",2023-01-01,"16268","16268","1626",NA,"Hospedagem e Turismo","1983-12-21","1997-05-14","MARINA DE IRACEMA PARK SA","Privado",12,"RAMO TURISTICO, DE HOTELARIA EM GERAL, SERVICOS DE ANCORADOURO E ACOSTAMENTO DE EMBARCACOES DE RECREIO E SERVICO DE SUPRIMENTO AS TRIPUILACOES DAS EMBARCACOES"
"28.195.667/0001-06",2023-01-01,"20958","20958","2095","ABCB","Bancos","1983-12-27","2007-07-23","BCO ABC BRASIL S.A.","Estrangeiro Holding",12,"O Banco tem por objeto a prática de operações ativas, passivas e acessórias inerentes às respectivas carteiras autorizadas pelo Banco Central do Brasil."
"33.937.681/0003-30",2011-01-01,"80128","80128","8012",NA,"Serviços Transporte e Logística","1983-12-30","2011-09-02","Lan Airlines S.A.","Estrangeiro",12,"Transporte de passageiros e transporte de carga."
"33.937.681/0001-78",2016-01-01,"80128","80128","8012",NA,"Serviços Transporte e Logística","1983-12-30","2011-09-02","LATAM AIRLINES GROUP S.A.","Estrangeiro",12,"Transporte de passageiros e transporte de carga."
"53.518.684/0001-84",2015-01-01,"19755","19755","1975",NA,"Arrendamento Mercantil","1984-02-29","2005-06-06","HSBC LEASING ARRENDAMENTO MERCANTIL (BRASIL) S/A","Privado",12,"Prática de todas as operações de arrendamento mercantil, permitidas pela Lei nº 6099, de 12 de setembro de 1974 com as alterações introduzidas pela Lei nº 7132, de 26.10.83, de bens móveis e imóveis d"
"90.076.886/0001-40",2023-01-01,"13765","13765","1376","MNPR","Emp. Adm. Part. - Alimentos","1984-08-01","1990-12-21","MINUPAR PARTICIPACOES S.A.","Privado",12,"Participação em outras empresas, bem como criação, abate, industrialização, comercialização,importação e exportação de carnes e produtos derivados de aves, e prestação de serviços aterceiros."
"53.790.218/0001-53",2017-01-01,"12262","12262","1226","LFFE","Emp. Adm. Part. - Telecomunicações","1984-09-11","1985-01-04","JPSP INVESTIMENTOS E PARTICIPAÇÕES S/A","Privado",12,""
"00.080.671/0001-00",2023-01-01,"26190","26190","2619",NA,"Alimentos","1984-12-28","2021-09-15","CARAMURU ALIMENTOS S.A.","Privado",12,"Industrialização, produção, beneficiamento, processamento, comercialização exportação e importação de: cereais, sementes e frutos oleaginosos, insumos agropecuários e Biocombustíveis."
"29.780.061/0001-09",2023-01-01,"13781","13781","1378","SCAR","Emp. Adm. Part. - Sem Setor Principal","1985-01-22","1991-03-25","SAO CARLOS EMPREEND E PARTICIPACOES S.A.","Privado",12,"Compra e venda de imóveis prontos ou a construir locação de bens imóveis administração de empreendimentos imobiliários próprios ou de terceiros exercício de outras atividades correlatas e outros"
"00.994.533/0001-36",2017-01-01,"15652","15652","1565",NA,"Serviços Transporte e Logística","1985-03-12","1996-07-18","COMERCIAL QUINTELLA COM EXP SA EM LIQUIDAÇÃO","Privado",12,"Transporte Multimodal de Cargas e Comércio"
"14.388.520/0001-28",2014-01-01,"80144","80144","8014",NA,"Petróleo e Gás","1985-04-10","2011-12-23","Pacific Rubiales Energy Corp.","Privado",12,"A Companhia tem como principal atividade a exploração, desenvolvimento e produção de petróleo e gás natural na Colômbia, Peru e Guatemala, sendo a maior companhia independente da Colômbia neste setor."
"07.636.657/0001-99",2023-01-01,"26425","26425","2642",NA,"Metalurgia e Siderurgia","1985-05-07","2021-11-29","Aço Verde do Brasil S.A","Privado",12,"Industrialização, comercialização, inclusive importação e exportação de produtos siderúrgicos, em especial aço e ferro gusa em todas as suas formas e seus subprodutos."
"29.388.352/0001-48",2012-01-01,"12840","12840","1284","REEM","Metalurgia e Siderurgia","1985-05-22","1986-06-12","RIMET EMPREEND. INDS. E COMERCIAIS S/A","Privado",12,"FABRICAÇÃO DE EMBALGENS METALICAS PARA ACONDICIONAMENTO DE ALIMENTOS, PRODUTOS QUIMICOS, ENTRE OUTROS."
"54.526.082/0001-31",2019-01-01,"12530","12530","1253","ITEC","Comunicação e Informática","1985-06-01","1985-11-14","ITAUTEC S.A. - GRUPO ITAUTEC","Privado Holding",12,"Participação em outras sociedades no País e no exterior, em especial naquelas que atuam na fabricação e comercialização de equipamentos de automações bancária e comercial e na prestação de serviços"
"61.065.751/0001-80",2023-01-01,"16306","16306","1630","RSID","Construção Civil, Mat. Constr. e Decoração","1985-06-27","1997-07-01","ROSSI RESIDENCIAL S.A. - EM RECUPERAÇÃO JUDICIAL","Privado",12,"Compra e venda de imóveis, desmembramento e loteamento de terrenos, incorporação imobiliária, construção de imóveis destinados à venda, e a participação em outras sociedades."
"28.573.830/0001-27",2016-01-01,"20508","20508","2050",NA,"Hospedagem e Turismo","1985-07-09","2015-06-25","TAIPE TRANCOSO EMPREENDIMENTOS S/A","Privado",12,"Desenvolvimento e Exploração de Resort em Trancoso - Porto Seguro - Bahia"
"01.468.594/0001-22",2022-01-01,"25666","25666","2566",NA,"Comunicação e Informática","1985-08-08","2021-04-06","LG Informática S.A.","Privado",12,"Licenciamento/cessão de direito de uso de programas de computador."
"90.400.888/0001-42",2023-01-01,"20532","20532","2053","SANB","Bancos","1985-08-09","2007-03-02","BCO SANTANDER (BRASIL) S.A.","Estrangeiro Holding",12,"Banco Múltiplo com Carteira Comercial"
"78.876.950/0001-71",2022-01-01,"14761","14761","1476","HGTX","Têxtil e Vestuário","1985-08-19","1995-01-26","CIA HERING","Privado",12,"Confecção de artigos do vestuário e acessórios"
"90.441.460/0001-48",2023-01-01,"22780","22780","2278","UCAS","Construção Civil, Mat. Constr. e Decoração","1985-09-02","2012-04-25","UNICASA INDÚSTRIA DE MÓVEIS S.A.","Privado",12,"Indústria, comércio, prestação de serviços, importação e exportação de produtos relacionados ao ramo de mobiliário em geral, planejado e modulado de madeira, ferro, aço, alumínio e outros materiais."
"29.950.060/0001-57",2023-01-01,"22985","22985","2298","NRTQ","Farmacêutico e Higiene","1985-12-20","2012-11-23","NORTEC QUÍMICA S.A.","Privado",12,"Química Fina, Ciências da Vida, fabricantes de Insumos Farmacêuticos Ativos - matéria-prima para a Indústria Farmacêutica"
"79.313.086/0001-62",2011-01-01,"14397","14397","1439","WISA","Metalurgia e Siderurgia","1986-05-12","2010-01-04","WIEST SA","Privado Holding",12,"Metalurgica"
"22.164.990/0001-36",2015-01-01,"22373","22373","2237",NA,"Comércio (Atacado e Varejo)","1986-06-01","2015-06-25","ELETROSOM S/A","Privado",12,"comércio atacadista e varejista de máquinas, móveis e aparelhos de uso doméstico, equipamentos eletro-eletrônicos, produtos para informática, artigos para presentes, como brinquedos e utilidades domés"
"79.430.682/0001-22",2023-01-01,"25429","25429","2542",NA,"Comércio (Atacado e Varejo)","1986-06-26","2021-01-14","FARMÁCIA E DROGARIA NISSEI S.A.","Privado",12,"Comércio varejista de produtos farmacêuticos, alimentos, cosméticos, e outros produtos, bem como o comércio atacadista de medicamentos e materiais em geral."
"22.261.473/0001-85",2023-01-01,"25178","25178","2517",NA,"Saneamento, Serv. Água e Gás","1986-07-15","2020-10-06","COMPANHIA DE GÁS DE MINAS GERAIS - GASMIG","Estatal Holding",12,"Exploração dos serviços públicos de distribuição de gás canalizado, aquisição, armazenamento, transporte, transmissão, distribuição e comercialização de gás combustível ou de subprodutos e derivados."
"79.655.916/0001-30",2012-01-01,"15610","15610","1561",NA,"Construção Civil, Mat. Constr. e Decoração","1986-09-11","1996-06-21","CECRISA REVESTIMENTOS CERAMICOS SA","Privado",12,"Indústria e Comércio de Revestimentos Cerâmicos S/A"
"14.998.371/0001-19",2023-01-01,"21156","21156","2115",NA,"Alimentos","1986-09-11","2007-10-16","J. MACEDO S.A.","Privado",12,"Industrialização de massas alimentícias, farinhas, misturas para bolo domésticas, biscoitos, sobremesas e derivados de trigo."
"56.444.250/0001-75",2023-01-01,"14850","14850","1485",NA,"Emp. Adm. Part. - Sem Setor Principal","1986-09-16","1995-05-02","HAUSCENTER SA","Privado",12,"ALUGUEL DE IMÓVEIS"
"56.806.656/0001-50",2014-01-01,"14559","14559","1455","RHDS","Emp. Adm. Part. - Petroquímicos e Borracha","1986-12-29","1994-09-08","M&G POLIÉSTER SA","Estrangeiro Holding",12,"Participação e Administração"
"58.119.199/0001-51",2023-01-01,"20125","20125","2012","ODPV","Serviços médicos","1987-08-28","2006-06-13","ODONTOPREV S.A.","Privado",12,"Operadora de planos odontológicos"
"12.049.631/0001-84",2023-01-01,"21067","21067","2106","MDNE","Construção Civil, Mat. Constr. e Decoração","1987-08-31","2007-08-23","MOURA DUBEUX ENGENHARIA S/A","Privado",12,"Compra e venda de imóveis, locação, desmembramento ou loteamento de terrenos,incorporação imobiliária ou construção de imóveis destinados à venda, participação em outrassociedades."
"22.770.366/0001-82",2019-01-01,"14133","14133","1413","TOYB","Máquinas, Equipamentos, Veículos e Peças","1987-09-28","1993-06-21","TEC TOY S.A.","Privado",12,"Industr/Com.brinquedos, jogos eletron. e entretenimento"
"16.404.287/0001-55",2023-01-01,"13986","13986","1398","SUZB","Papel e Celulose","1987-12-08","1992-04-15","SUZANO S.A.","Privado",12,"Indústria e Comércio de Papel e Celulose"
"58.430.828/0001-60",2023-01-01,"24627","24627","2462","BLAU","Farmacêutico e Higiene","1987-12-08","2019-01-11","Blau Farmacêutica S.A.","Privado",12,"A Companhia dedica-se à fabricação, comercialização, pesquisa e desenvolvimento de medicamentos de alta complexidade."
"91.820.068/0001-72",2016-01-01,"13412","13412","1341","PTPA","Emp. Adm. Part. - Embalagens","1988-01-21","1988-11-22","ÉVORA SA","Privado",12,"Empresa de administração e participação em negócios de embalagens metálicas e plásticas, nãotecidos de polipropileno e florestamento."
"31.895.683/0001-16",2018-01-01,"21377","21377","2137",NA,"Bancos","1988-03-30","2008-03-07","BANCO INDUSTRIAL DO BRASIL","Privado",12,"Banco Múltiplo"
"80.680.093/0001-81",2023-01-01,"26786","26786","2678",NA,"Comunicação e Informática","1988-05-24","2022-05-12","Senior Sistemas S.A.","Privado",12,"Desenvolvimento de programas de computador sob encomenda, consultoria, suporte técnico, manutenção e outros serviços em tecnologia da informação."
"58.877.812/0001-08",2012-01-01,"19046","19046","1904","CPNY","Emp. Adm. Part. - Const. Civil, Mat. Const. e Decoração","1988-05-25","2001-09-03","BROOKFIELD SÃO PAULO EMPREENDIMENTOS IMOBILIÁRIOS S.A.","Privado",12,""
"32.110.314/0001-33",2011-01-01,"14010","14010","1401",NA,"Alimentos","1988-07-28","1992-08-03","PREDILETO ALIMENTOS SA","Privado",12,"Moagem de Trigo."
"59.418.806/0001-47",2023-01-01,"25208","25208","2520","TFCO","Têxtil e Vestuário","1988-08-19","2020-10-22","TRACK & FIELD CO S.A.","Privado",12,"Atuação no varejo dos setores de vestuário, acessórios e calçados, dentre outros."
"24.962.466/0001-36",2023-01-01,"15300","15300","1530","FRRN","Serviços Transporte e Logística","1988-09-22","1995-12-27","RUMO MALHA NORTE S.A.","Privado",12,"(i) construção e exploração de sistemas de transporte ferroviário de carga, rodovias e hidrovias (ii) prestação de serviços de transporte de carga em ferrovias, rodovias e hidrovias etc."
"24.956.666/0001-86",2015-01-01,"18490","18490","1849","CLAN","Agricultura (Açúcar, Álcool e Cana)","1988-10-27","1999-11-26","CLARION S/A AGROINDUSTRIAL","Privado",12,""
"59.717.553/0001-02",2023-01-01,"26034","26034","2603","MLAS","Comunicação e Informática","1988-11-21","2021-07-20","MULTILASER INDUSTRIAL S.A.","Privado",12,"Fabricação de periféricos para equipamentos de informática"
"59.789.545/0001-71",2023-01-01,"13447","13447","1344","PPAR","Emp. Adm. Part. - Sem Setor Principal","1988-11-29","1989-03-03","POLPAR S.A.","Privado",12,"Participação em outras empresas"
"81.106.957/0001-19",2023-01-01,"27278","27278","2727",NA,"Máquinas, Equipamentos, Veículos e Peças","1989-01-11","2023-08-16","DESCARBONIZE SOLUÇÕES S.A.","Privado",12,"Fabricação de geradores fotovoltaicos."
"60.537.263/0001-66",2023-01-01,"24953","24953","2495","ALPK","Serviços Transporte e Logística","1989-04-19","2020-05-13","ALLPARK EMPREENDIMENTOS, PARTICIPAÇÕES E SERVIÇOS S.A.","Privado",12,"Outras atividades de publicidade não especificadas anteriormente gestão de ativos intangíveis não-financeiros outras atividades de serviços pessoais não especificadas anteriormente."
"25.089.509/0001-83",2023-01-01,"23809","23809","2380",NA,"Saneamento, Serv. Água e Gás","1989-04-25","2015-12-21","COMPANHIA DE SANEAMENTO DO TOCANTINS - SANEATINS","Privado",12,"Implantação, a construção de sistemas e a exploração dos serviços de água potável e de esgoto sanitário nas localidades em que detiver autorização, permissão ou concessão."
"81.243.735/0001-48",2023-01-01,"20362","20362","2036","POSI","Comunicação e Informática","1989-05-26","2006-12-06","POSITIVO TECNOLOGIA S.A.","Privado",12,"Fabricação de hardware."
"92.859.974/0001-43",2017-01-01,"23183","23183","2318","ALTS","Máquinas, Equipamentos, Veículos e Peças","1989-06-06","2013-07-02","ALTUS SISTEMAS DE AUTOMAÇÃO S.A.","Privado",12,"Desenvolvimento, fabricação e comercialização de máquinas equipamentos e componentes eletrônicos automação industrial e predial e participação no capital de outras empresas"
"32.681.371/0001-72",2023-01-01,"21202","21202","2120",NA,"Serviços Transporte e Logística","1989-07-03","2007-11-27","VIX LOGÍSTICA S.A.","Privado",12,"Transporte Rodoviário de cargas em geral, intermunicipal, interestadual e internacional transporte coletivo rodoviário, intermunicipal, interestadual e internacional de passageiros."
"35.791.391/0001-94",2023-01-01,"23302","23302","2330","QUSW","Emp. Adm. Part. - Comunicação e Informática","1989-09-06","2013-12-03","QUALITY SOFTWARE S.A.","Privado",12,"Serviços nos Setores de informática, auditoria de sistemas softwares treinamentos,desenvolvimento de sistemas de suporte técnico hardware e software em geral design gráfico e editoração eletronica."
"93.167.658/0001-73",2014-01-01,"13790","13790","1379",NA,"Comércio (Atacado e Varejo)","1989-11-24","1991-04-15","SDV ADM-DE SHOPPING CENTERS SA","Privado Holding",12,"Administração de Shopping Centers"
"81.616.807/0001-55",2023-01-01,"27219","27219","2721","EGGY","Alimentos","1989-11-28","2023-06-12","Granja Faria S.A.","Privado",12,"Produção e comercialização de pintos de um dia e de ovos férteis e comerciais, criação de frangos para corte, comércio varejista de hortifrutigranjeiros, restaurante."
"62.092.739/0001-28",2010-01-01,"20923","20923","2092",NA,"Agricultura (Açúcar, Álcool e Cana)","1989-12-29","2007-07-16","COSAN ALIMENTOS S.A.","Privado",3,"Fabricação de Açúcar, Etanol e Energia Elétrica"
"39.115.514/0001-28",2023-01-01,"17850","17850","1785",NA,"Serviços Transporte e Logística","1990-03-28","1998-10-20","RUMO MALHA OESTE S.A.","Privado",12,"Prestar serviço de transporte ferroviário de cargas e armazenagens de cargas."
"26.386.169/0001-15",2017-01-01,"15890","15890","1589",NA,"Arrendamento Mercantil","1990-06-19","1996-11-29","MERCANTIL DO BRASIL LEASING SA","Privado",12,"Arrendamento Mercantil Financeiro"
"82.120.676/0001-83",2023-01-01,"26395","26395","2639",NA,"Emp. Adm. Part. - Comércio (Atacado e Varejo)","1990-08-01","2021-11-22","ALMEIDA JUNIOR SHOPPING CENTERS S.A.","Privado",12,"Empresa full service no setor de shopping centers. Suas atividades englobam a concepção, o planejamento, o desenvolvimento e a administração de shopping centers regionais e complexos imobiliários."
"65.654.303/0001-73",2023-01-01,"14214","14214","1421",NA,"Arrendamento Mercantil","1990-09-27","1993-09-28","DIBENS LEASING S.A. - ARREND.MERCANTIL","Privado",12,"Arrendamento Mercantil"
"82.373.077/0001-71",2016-01-01,"20656","20656","2065","BEMA","Comunicação e Informática","1990-10-01","2007-04-17","BEMATECH IND COM EQUIP ELETRONICOS SA","Privado",12,"Soluções de tecnologia para o varejo, food service e hospitality."
"64.904.295/0001-03",2023-01-01,"24228","24228","2422","CAML","Alimentos","1990-11-09","2017-09-26","CAMIL ALIMENTOS S.A.","Privado Holding",2,"Industrialização e comercialização de grãos, pescados, açúcar, massas, biscoitos e café."
"05.721.735/0001-28",2021-01-01,"80047","80047","8004","WSON","Serviços Transporte e Logística","1990-12-06","2007-04-25","WILSON SONS LTD.","Estrangeiro",12,"Terminais Portuários, Rebocagem, Offshore, Logística, Agenciamento Marítimo e Estaleiros."
